{
  "$schema": "http://json-schema.org/draft-07/schema#",
  "title": "codex PostToolUse input",
  "type": "object",
  "required": ["hook_event_name", "session_id", "cwd", "tool_name", "tool_input", "tool_response"],
  "additionalProperties": false,
  "properties": {
    "hook_event_name": { "const": "PostToolUse" },
    "session_id": { "type": "string" },
    "cwd": { "type": "string" },
    "transcript_path": { "type": "string" },
    "model": { "type": "string" },
    "turn_id": { "type": "string" },
    "tool_name": { "type": "string" },
    "tool_input": { "type": "object" },
    "tool_response": { "type": "object" }
  }
}
